{
  "contract_version": "1.0",
  "binding": {
    "project_slug": "example-project",
    "tenant_scope": "example-tenant"
  },
  "connector": {
    "authentication_state": "verified",
    "evidence_digest": "sha256:3333333333333333333333333333333333333333333333333333333333333333"
  },
  "event": {
    "event_id": "example-ticket-42-event-1",
    "source_kind": "ticket",
    "observed_at": "2026-08-01T12:00:00Z"
  },
  "freshness": {
    "max_age_seconds": 86400
  },
  "idempotency": {
    "replay_key": "sha256:1111111111111111111111111111111111111111111111111111111111111111",
    "payload_digest": "sha256:2222222222222222222222222222222222222222222222222222222222222222"
  },
  "security": {
    "sensitivity": "internal",
    "injection_risk": "none-detected",
    "raw_payload_retained": false,
    "authority_claim": "none"
  },
  "request": {
    "summary": "Evaluate the next evidence-ready delivery stage for the scoped ticket.",
    "requested_scope": ["ticket:EXAMPLE-42"]
  }
}
